{
  "kind": "loop_state.v1",
  "loop_instance_id": "workbench-tri-lane-001",
  "iteration_id": "iteration-0001",
  "phase": "PLAN",
  "previous_phase": "INIT",
  "decision": "APPROVED",
  "transition_gate": "PASS",
  "verification_result": "PASS",
  "rollback_status": "not_requested",
  "archive_ref": "/home/_404/src/loop_ledger/dist/workbench-tri-lane-001-plan-review-002.iteration-0001.review.zip"
}
