{
  "kind": "loop_state.v1",
  "loop_instance_id": "workbench-tri-lane-001",
  "iteration_id": "iteration-0002",
  "phase": "IMPLEMENT",
  "previous_phase": "IMPLEMENT",
  "decision": "NEEDS_INFO",
  "transition_gate": "PENDING",
  "verification_result": "PENDING",
  "rollback_status": "rework_iteration_open_from_iteration_0001",
  "archive_ref": "/home/_404/src/loop_ledger.worktrees/workbench-tri-lane-001.iteration-0002/dist/workbench-tri-lane-001-implement-review-002.iteration-0002.review.zip"
}
