{
  "kind": "loop_state.v1",
  "loop_instance_id": "workbench-tri-lane-001",
  "iteration_id": "iteration-0001",
  "phase": "PLAN",
  "previous_phase": "INIT",
  "decision": "IN_PROGRESS",
  "transition_gate": "PENDING",
  "verification_result": "PENDING",
  "rollback_status": "not_requested",
  "archive_ref": "/home/_404/src/loop_ledger.worktrees/workbench-tri-lane-001.iteration-0001/dist/workbench-tri-lane-001.iteration-0001.review.zip"
}
